{
  "event_type": "agent_tool_action",
  "session_id": "session-demo-002",
  "action_id": "action-demo-002",
  "actor_ref": "employee-ref-7",
  "timestamp": "2026-10-30T06:03:00+00:00",
  "tool_name": "workspace-export",
  "action_type": "data_export",
  "target_ref": "dataset-ref:customer-success",
  "data_classification": "sensitive",
  "destination_class": "unknown_external",
  "requested_scopes": [
    "files.read",
    "directory.read.all"
  ],
  "estimated_bytes": 8192,
  "prompt_hash": "sha256:755237f5e7d0cd574ca84bcb1c377214b44083068e14bc862451f1d0f473c960",
  "tool_output_hash": "sha256:da359fdf5386aeea8951f42a8e1e9c29d1bbd51e3a9c5e691e8b3f195e486dd4"
}
